{
  "schema_version": 1,
  "project_id": "project-1",
  "sequence": 1,
  "authorization": {
    "request_id": "request-1",
    "project_id": "project-1",
    "actor_id": "user-1",
    "original_text": "Create a source-faithful observational cut.",
    "asset_ids": [
      "asset-1"
    ],
    "provider": "fixture",
    "model": "fixture",
    "allowed_data": [
      "request",
      "evidence"
    ],
    "protected_refs": [],
    "policy_version": "request-v1",
    "expires_at": "2027-01-01T00:00:00Z",
    "deployment": null
  },
  "authorization_generation": 0,
  "cancellation_generation": 0,
  "revoked": false,
  "revisions": [
    {
      "revision": 1,
      "raw_text": "Create a source-faithful observational cut.",
      "base_timeline_version": 0,
      "viewed_timeline_version": null,
      "preserve_refs": [],
      "created_at": "2026-09-18T00:00:00Z"
    }
  ],
  "status": "received",
  "drafts": [],
  "adopted_draft_id": null,
  "viewed_draft_id": null,
  "latest_draft_id": null,
  "active_run": null,
  "model_calls": []
}
